{
  "$schema": "http://json-schema.org/draft-07/schema#",
  "$id": "http://truenas.local:30008/paulwhitten/autonomous_copilot_agent/workflow.schema.json",
  "title": "Workflow Definition",
  "description": "Data-driven state machine for multi-agent workflows. Each workflow is a directed graph of states with role assignments, prompt templates, tool permissions, and transition rules. The LLM gets one prompt for one state and a gated tool set. Transitions are deterministic code, not LLM decisions.",
  "type": "object",
  "required": ["id", "name", "description", "version", "initialState", "terminalStates", "globalContext", "states"],
  "additionalProperties": false,
  "properties": {
    "$schema": {
      "type": "string",
      "description": "Optional JSON Schema self-reference for editor validation."
    },
    "id": {
      "type": "string",
      "minLength": 1,
      "pattern": "^[a-z0-9][a-z0-9-]*$",
      "description": "Unique workflow identifier (e.g., 'dev-qa-merge'). Must be lowercase with hyphens.",
      "examples": ["dev-qa-merge", "regulatory", "v-model-regulatory"]
    },
    "name": {
      "type": "string",
      "minLength": 1,
      "description": "Human-readable workflow name.",
      "examples": ["Development with QA Gate"]
    },
    "description": {
      "type": "string",
      "description": "What this workflow does. Shown in generated documentation."
    },
    "version": {
      "type": "string",
      "pattern": "^\\d+\\.\\d+\\.\\d+$",
      "description": "Semantic version for forward compatibility.",
      "examples": ["2.0.0"]
    },
    "initialState": {
      "type": "string",
      "minLength": 1,
      "description": "State name to assign when a new task enters this workflow. Must reference a key in 'states'."
    },
    "terminalStates": {
      "type": "array",
      "items": { "type": "string" },
      "minItems": 1,
      "uniqueItems": true,
      "description": "State names that signify the task is complete (no further transitions). Each must reference a key in 'states'."
    },
    "globalContext": {
      "type": "object",
      "additionalProperties": { "type": "string" },
      "description": "Context variables available to every prompt template via {{variable}} substitution. Merged with per-task context; task context wins on conflict.",
      "examples": [
        {
          "projectPath": "workspace/project",
          "buildCommand": "cargo build",
          "testCommand": "cargo test"
        }
      ]
    },
    "states": {
      "type": "object",
      "minProperties": 2,
      "additionalProperties": { "$ref": "#/$defs/StateDefinition" },
      "description": "State definitions keyed by state name (uppercase by convention, e.g., IMPLEMENTING). Must include at least the initialState and one terminal state."
    }
  },
  "$defs": {
    "StateDefinition": {
      "type": "object",
      "required": ["name", "role", "description", "prompt", "allowedTools", "transitions"],
      "additionalProperties": false,
      "description": "A single state in the workflow graph.",
      "properties": {
        "name": {
          "type": "string",
          "minLength": 1,
          "description": "Human-readable state name (e.g., 'Implementation', 'QA Validation')."
        },
        "role": {
          "type": "string",
          "minLength": 1,
          "description": "Which agent role handles this state. The engine resolves roles to agent hostnames via the team roster.",
          "examples": ["manager", "developer", "qa"]
        },
        "description": {
          "type": "string",
          "description": "What this state does. Used in logging, debugging, and generated state diagrams."
        },
        "prompt": {
          "type": "string",
          "description": "Prompt template sent to the LLM when executing this state. This is the 'how' -- procedural instructions for the agent. The 'what' (task-specific details) comes from the assignment's taskPrompt field.\n\nUses {{variable}} substitution. Available variables include globalContext keys, task context accumulated from prior states (branch, commitSha, testResults, etc.), and any requiredOutputs produced by earlier states.\n\nTerminal states may have an empty prompt."
        },
        "allowedTools": {
          "type": "array",
          "items": { "type": "string" },
          "description": "Recommended tools for this state (ADVISORY, not a whitelist). These are rendered into the prompt as guidance but all SDK built-in tools remain available. This avoids catastrophic failures from overly restrictive tool gating.\n\nAccepts individual tool names or group names.\n\nTool groups:\n  - mailbox:read  -> check_mailbox, read_message, archive_message\n  - mailbox:send  -> send_message, send_broadcast\n  - reporting     -> send_completion_report, escalate_issue\n  - team          -> get_team_roster, find_agents_by_role, find_agents_by_capability, get_agent_info\n  - terminal      -> run_in_terminal, get_terminal_output\n  - file_ops      -> read_file, create_file, replace_string_in_file\n  - git           -> run_in_terminal"
        },
        "restrictedTools": {
          "type": "array",
          "items": { "type": "string" },
          "description": "Tools explicitly blocked in this state (ENFORCED deny-list). Unlike allowedTools (advisory), these are enforced -- the agent denies calls to tools on this list. Restriction is per tool, not per shell command (restricting the terminal blocks all shell use). Use sparingly for safety boundaries.\n\nExample: prevent developer from 'send_broadcast'.\n\nAccepts individual tool names or group names (same as allowedTools)."
        },
        "requiredOutputs": {
          "type": "array",
          "items": { "type": "string" },
          "uniqueItems": true,
          "description": "Context keys that MUST be present in StateExecutionResult.outputs before the engine allows a success transition. If any are missing, the transition is treated as a failure.\n\nExamples: ['branch', 'commitSha'], ['testResults', 'verdict']"
        },
        "transitions": {
          "$ref": "#/$defs/Transitions"
        },
        "maxRetries": {
          "type": "integer",
          "minimum": 0,
          "default": 2,
          "description": "Maximum consecutive failures before escalation. When retryCount exceeds this, the engine follows the onFailure transition."
        },
        "timeoutMs": {
          "type": "integer",
          "minimum": 0,
          "description": "Intended hard time limit for this state in milliseconds. NOT currently enforced: work items use the agent's adaptive timeout (agent.sdkTimeoutMs / timeoutStrategy)."
        },
        "onEntryCommands": {
          "type": "array",
          "items": { "$ref": "#/$defs/StateCommand" },
          "description": "Shell commands executed directly by the engine (child_process.execSync) on entering this state, BEFORE the main work items. The LLM is not involved. Template variables ({{branch}}, {{taskId}}, {{role}}, {{state}}) are resolved from accumulated task context + globalContext."
        },
        "onExitCommands": {
          "type": "array",
          "items": { "$ref": "#/$defs/StateCommand" },
          "description": "Shell commands executed directly by the engine on exiting this state, AFTER the main work items complete but BEFORE the state transition. Typically used to ensure git add/commit/push so downstream agents can see the work."
        },
        "entryActions": {
          "type": "array",
          "items": { "$ref": "#/$defs/StateAction" },
          "description": "Actions the engine executes automatically on entering this state. These are code actions, not LLM actions."
        },
        "exitActions": {
          "type": "array",
          "items": { "$ref": "#/$defs/StateAction" },
          "description": "Actions the engine executes automatically on successful exit from this state."
        },
        "tasks": {
          "type": "array",
          "items": { "type": "string", "minLength": 1 },
          "description": "Required tasks that the decomposition MUST include as work items. Each string describes a required deliverable or activity. The decomposition prompt builder composes these into: 'Work items MUST include: <task1>, <task2>, ...'. Gives workflow authors structured control over what the LLM includes in its breakdown.",
          "examples": [
            ["unit tests with 90% coverage", "cargo fmt", "validation of passing unit tests"]
          ]
        },
        "decompositionPrompt": {
          "type": "string",
          "description": "Additional free-form guidance injected into the decomposition prompt. Use for domain-specific advice that doesn't fit the structured 'tasks' array (e.g. ordering constraints, grouping rules). When both 'tasks' and 'decompositionPrompt' are present, the tasks sentence is rendered first."
        },
        "exitEvaluation": {
          "$ref": "#/$defs/ExitEvaluation",
          "description": "Structured exit evaluation for this state. When present, the engine asks the LLM a constrained question after work items complete and BEFORE the transition fires. The parsed answer determines success/failure routing. When absent, the engine falls back to regex-based fail detection or default success."
        },
        "permissions": {
          "type": "object",
          "additionalProperties": false,
          "description": "SDK permission overrides for this state. Applied by the agent on state entry (after onEntryCommands) and cleared on state exit (after onExitCommands). Use to enforce read-only validation states (e.g. { \"write\": \"deny\" }) at the SDK permission layer — the LLM physically cannot perform blocked operations. Only specified keys are overridden; unspecified kinds keep their base config policy.",
          "properties": {
            "write": {
              "type": "string",
              "enum": ["allow", "deny", "workingDir"],
              "description": "Override for file write permission. Set to 'deny' to block all file creation/modification during this state."
            },
            "read": {
              "type": "string",
              "enum": ["allow", "deny", "workingDir"],
              "description": "Override for file read permission."
            },
            "shell": {
              "type": "string",
              "enum": ["allow", "deny", "allowlist"],
              "description": "Override for shell command permission."
            },
            "url": {
              "type": "string",
              "enum": ["allow", "deny"],
              "description": "Override for URL/network access permission."
            },
            "mcp": {
              "type": "string",
              "enum": ["allow", "deny"],
              "description": "Override for MCP server tool call permission."
            }
          }
        }
      }
    },
    "Transitions": {
      "type": "object",
      "required": ["onSuccess", "onFailure"],
      "additionalProperties": false,
      "description": "Deterministic transition rules. These are NOT LLM decisions -- the engine evaluates StateExecutionResult.success and follows the appropriate edge.",
      "properties": {
        "onSuccess": {
          "type": ["string", "null"],
          "description": "State to move to on success. Must reference a key in 'states', or null for terminal states."
        },
        "onFailure": {
          "type": ["string", "null"],
          "description": "State to move to on failure. If same as the current state, the task retries in place (up to maxRetries). If different, moves to that state (typically a REWORK state or ESCALATED). Null means terminal."
        }
      }
    },
    "StateCommand": {
      "type": "object",
      "required": ["command", "reason"],
      "additionalProperties": false,
      "description": "A deterministic shell command executed directly by the engine (child_process.execSync) at state entry or exit. The engine logs stdout/stderr and respects failOnError. Template variables ({{branch}}, {{taskId}}, {{role}}, {{state}}) are resolved before execution.",
      "properties": {
        "command": {
          "type": "string",
          "minLength": 1,
          "description": "Shell command to execute. Supports {{variable}} template substitution from task context and globalContext. Examples: 'git fetch origin', 'git push origin {{branch}}', 'git checkout {{branch}}'."
        },
        "reason": {
          "type": "string",
          "minLength": 1,
          "description": "Human-readable reason logged by the engine for diagnostics. Provides context for why the command exists (e.g. 'If origin/{{branch}} does not exist yet, skip this step')."
        },
        "failOnError": {
          "type": "boolean",
          "default": true,
          "description": "If true (default), a command failure aborts subsequent commands in the sequence. Set to false for best-effort commands that may legitimately fail (e.g. resetting to a branch that does not exist on a fresh repo)."
        },
        "captureAs": {
          "type": "string",
          "minLength": 1,
          "description": "When set, the trimmed stdout is stored as a workflow context variable under this key. Designed for deterministic commands like 'git rev-parse HEAD' whose output must be reliably captured (e.g. as 'commitSha'). The captured value is merged into StateExecutionResult.outputs before the transition fires."
        }
      }
    },
    "StateAction": {
      "type": "object",
      "required": ["type", "params"],
      "additionalProperties": false,
      "description": "Automated action executed by the engine (not the LLM) on state entry or exit.",
      "properties": {
        "type": {
          "type": "string",
          "enum": ["send_to_role", "set_context", "log"],
          "description": "Action type:\n  - send_to_role: auto-send the task message to the state's role\n  - set_context: set a context variable\n  - log: emit a structured log entry"
        },
        "params": {
          "type": "object",
          "additionalProperties": { "type": "string" },
          "description": "Action-specific parameters. For send_to_role: no params needed. For set_context: {key: value}. For log: {message: '...', level: 'info'}."
        }
      }
    },
    "ExitEvaluation": {
      "type": "object",
      "required": ["prompt", "responseFormat", "mapping"],
      "additionalProperties": false,
      "description": "Structured exit evaluation that replaces regex-based fail detection. After work items complete, the engine sends a constrained question to the LLM. The response is parsed deterministically and mapped to a success or failure outcome, which drives the state transition.",
      "properties": {
        "prompt": {
          "type": "string",
          "minLength": 1,
          "description": "Question asked to the LLM after work items complete. Should be answerable with a single word (true/false for boolean, or one of the declared choices for enum). Supports {{variable}} template substitution from task context and globalContext."
        },
        "responseFormat": {
          "type": "string",
          "enum": ["boolean", "enum"],
          "description": "Expected response format.\n  - boolean: LLM must answer true or false (yes/no also accepted)\n  - enum: LLM must answer with one of the declared choices"
        },
        "choices": {
          "type": "array",
          "items": { "type": "string" },
          "minItems": 2,
          "uniqueItems": true,
          "description": "For enum format: the valid choices the LLM can pick from. Ignored for boolean format."
        },
        "mapping": {
          "type": "object",
          "additionalProperties": {
            "type": "string",
            "enum": ["success", "failure"]
          },
          "description": "Maps parsed response values to routing outcomes.\n\nFor boolean: keys are 'true' and 'false'.\nFor enum: keys are each of the declared choices.\nValues are 'success' or 'failure'."
        },
        "defaultOutcome": {
          "type": "string",
          "enum": ["success", "failure"],
          "default": "failure",
          "description": "Outcome when the LLM response cannot be parsed into any recognized value. Defaults to 'failure' (safe default -- forces rework rather than silently passing)."
        }
      }
    }
  }
}
