{
  "$schema": "./workflow.schema.json",
  "id": "hello-world",
  "name": "Hello World Workflow",
  "description": "A minimal workflow for learning. Manager assigns a simple task, developer completes it.",
  "version": "1.0.0",
  "initialState": "ASSIGN",
  "terminalStates": ["DONE"],
  "globalContext": {
    "projectPath": "workspace/project"
  },
  "states": {
    "ASSIGN": {
      "name": "Task Assignment",
      "role": "manager",
      "description": "Manager assigns a simple task to the developer.",
      "prompt": "You have a task to delegate.\n\nTask: {{taskDescription}}\n\nYour job:\n1. Acknowledge the task\n2. Report readiness to proceed\n\nSimply respond with: 'Task received: [task summary]. Ready to proceed.'\n\nDo NOT use any tools. Just respond with text.",
      "allowedTools": [],
      "requiredOutputs": [],
      "transitions": {
        "onSuccess": "DO_WORK",
        "onFailure": "DONE"
      }
    },

    "DO_WORK": {
      "name": "Implementation",
      "role": "developer",
      "description": "Developer completes the assigned task.",
      "prompt": "Complete this task: {{taskDescription}}\n\n**Procedure:**\n1. Navigate to the project directory: cd {{projectPath}}\n2. Create or modify files as needed\n3. Keep it simple - a single file is fine\n4. Report what you did\n\n**Example:** If the task is 'Create a hello world Python script', create `hello.py` with a print statement.\n\nAfter completing the work, describe what you created/changed.",
      "allowedTools": ["terminal", "file_ops"],
      "requiredOutputs": [],
      "transitions": {
        "onSuccess": "DONE",
        "onFailure": "DONE"
      },
      "maxRetries": 1,
      "timeoutMs": 180000,
      "exitEvaluation": {
        "prompt": "Based on the work just completed, was a file created or modified in the project directory as described in the task? Answer with a single word: true or false.",
        "responseFormat": "boolean",
        "mapping": { "true": "success", "false": "failure" },
        "defaultOutcome": "failure"
      }
    },

    "DONE": {
      "name": "Complete",
      "role": "manager",
      "description": "Task is complete.",
      "prompt": "The task is complete. Review the work done.",
      "allowedTools": [],
      "transitions": {
        "onSuccess": null,
        "onFailure": null
      }
    }
  }
}
